{
  "$schema": "https://json-schema.org/draft/2020-12/schema",
  "$id": "https://charlie-portfolio.local/schemas/notes.schema.json",
  "title": "Notes (HackMD) Index JSON",
  "type": "object",
  "additionalProperties": false,
  "required": ["schema_version", "generatedAt", "notes", "version"],
  "properties": {
    "schema_version": { "type": "integer", "const": 1 },
    "generatedAt": { "type": "string", "format": "date-time" },
    "version": { "type": "integer", "minimum": 1 },
    "notes": {
      "type": "array",
      "items": {
        "type": "object",
        "additionalProperties": false,
        "required": [
          "id",
          "url",
          "title",
          "summary",
          "tags",
          "publishedAt",
          "featured",
          "displayOrder",
          "isVisible"
        ],
        "properties": {
          "id": { "type": "string", "pattern": "^[a-z0-9-]+$" },
          "url": { "type": "string", "pattern": "^https://" },
          "title": { "type": "string", "minLength": 1 },
          "summary": { "type": "string" },
          "tags": {
            "type": "array",
            "items": { "type": "string", "minLength": 1 }
          },
          "publishedAt": { "type": "string", "pattern": "^\\d{4}-\\d{2}-\\d{2}$" },
          "updatedAt": {
            "type": ["string", "null"],
            "pattern": "^\\d{4}-\\d{2}-\\d{2}$"
          },
          "featured": { "type": "boolean" },
          "displayOrder": { "type": "integer", "minimum": 0 },
          "isVisible": { "type": "boolean" }
        }
      }
    }
  }
}
