{
  "schema_version": 1,
  "generatedAt": "2026-05-07T00:00:00.000Z",
  "version": 3,
  "notes": [
    {
      "id": "url-to-page-journey",
      "url": "https://hackmd.io/@jack755051/By27lgL3Wl",
      "title": "完整解析：從輸入 URL 到頁面顯示的奇幻旅程",
      "summary": "從網路底層出發，延伸至後端架構與瀏覽器引擎機制，建構全端系統架構思維。",
      "tags": ["Network", "Browser", "DNS", "HTTP", "Rendering"],
      "publishedAt": "2026-05-07",
      "updatedAt": null,
      "featured": true,
      "displayOrder": 0,
      "isVisible": true
    },
    {
      "id": "nuxt3-architecture",
      "url": "https://hackmd.io/@jack755051/SyWdBhh3-l",
      "title": "Nuxt 3 核心架構與部署配置筆記",
      "summary": "整理 Nuxt 3 的核心架構、渲染模式、部署配置與實戰經驗。",
      "tags": ["Nuxt 3", "SSR", "Deployment"],
      "publishedAt": "2026-05-07",
      "updatedAt": null,
      "featured": true,
      "displayOrder": 1,
      "isVisible": true
    },
    {
      "id": "frontend-notes-03",
      "url": "https://hackmd.io/@jack755051/HJZyNe83Zg",
      "title": "前端知識補充_03",
      "summary": "前端進階知識整理，涵蓋常見面試與實務重點。",
      "tags": ["Frontend", "JavaScript"],
      "publishedAt": "2026-05-07",
      "updatedAt": null,
      "featured": false,
      "displayOrder": 2,
      "isVisible": true
    },
    {
      "id": "frontend-notes-05",
      "url": "https://hackmd.io/@jack755051/HywaTRphWg",
      "title": "前端補充知識_05",
      "summary": "前端進階知識補充，持續累積實務經驗。",
      "tags": ["Frontend", "JavaScript"],
      "publishedAt": "2026-05-07",
      "updatedAt": null,
      "featured": false,
      "displayOrder": 3,
      "isVisible": true
    },
    {
      "id": "browser-storage",
      "url": "https://hackmd.io/@jack755051/HJfgSgUnbl",
      "title": "瀏覽器的儲存機制",
      "summary": "Cookie、LocalStorage、SessionStorage 三大儲存機制的差異與使用場景。",
      "tags": ["Browser", "Storage", "Cookie"],
      "publishedAt": "2026-05-07",
      "updatedAt": null,
      "featured": false,
      "displayOrder": 4,
      "isVisible": true
    },
    {
      "id": "angular-core",
      "url": "https://hackmd.io/@jack755051/HJHIQKVhZl",
      "title": "Angular：企業級前端框架核心解析",
      "summary": "Angular 核心概念、模組系統、依賴注入與企業級開發實踐。",
      "tags": ["Angular", "TypeScript", "Enterprise"],
      "publishedAt": "2026-05-07",
      "updatedAt": null,
      "featured": false,
      "displayOrder": 5,
      "isVisible": true
    },
    {
      "id": "frontend-notes-02",
      "url": "https://hackmd.io/@jack755051/Hys-NpSTWx",
      "title": "前端知識補充_02",
      "summary": "建構工具、非同步狀態管理、渲染模式與容器化部署架構。",
      "tags": ["Frontend", "Webpack", "Vite", "Docker"],
      "publishedAt": "2026-05-07",
      "updatedAt": null,
      "featured": false,
      "displayOrder": 6,
      "isVisible": true
    },
    {
      "id": "vdom-reactive-principles",
      "url": "https://hackmd.io/@jack755051/S16HBd4n-x",
      "title": "現代前端框架機制：虛擬 DOM、聲明式 UI 與響應式原理",
      "summary": "虛擬 DOM 核心機制、Diff 算法、聲明式 UI 與 Vue/Angular/React 響應式原理比較。",
      "tags": ["Virtual DOM", "Reactive", "Vue", "Angular", "React"],
      "publishedAt": "2026-05-07",
      "updatedAt": null,
      "featured": true,
      "displayOrder": 7,
      "isVisible": true
    }
  ]
}
